{
  "schema_version": "0.6.0",
  "perturbation_id": "qsp-minimal-001",
  "created_at": "2026-10-18T02:10:00Z",

  "question_id": "q-100",

  "signals": {
    "assumption_changed": false,
    "problem_frame_changed": true,
    "design_target_changed": false,
    "reversal_detected": false,
    "new_questions_generated": false,
    "new_structure_generated": false
  },

  "classification": "moderate",

  "review_state": "observe"
}
